create table tt(
id int primary key not null auto_increment,
c1 int not null default 1,
c2 varchar(128),
c3 float,
key idx_1(c1),
key idx_2(c2)) engine=innodb row_format=gcs;
show create table tt;
Table	Create Table
tt	CREATE TABLE `tt` (
  `id` int(11) NOT NULL AUTO_INCREMENT,
  `c1` int(11) NOT NULL DEFAULT '1',
  `c2` varchar(128) DEFAULT NULL,
  `c3` float DEFAULT NULL,
  PRIMARY KEY (`id`),
  KEY `idx_1` (`c1`),
  KEY `idx_2` (`c2`)
) ENGINE=InnoDB DEFAULT CHARSET=latin1 /*!99000 ROW_FORMAT=GCS */ 
insert into tt set id=1;
select * from tt;
id	c1	c2	c3
1	1	NULL	NULL
create table t1(id int);
insert into t1 set id=100;
create temporary table t1(
id int primary key not null auto_increment,
c1 int not null default 1,
c2 varchar(128),
c3 float,
key idx_1(c1),
key idx_2(c2)) engine=innodb row_format=gcs;
insert into t1 set id=10;
show create table t1;
Table	Create Table
t1	CREATE TEMPORARY TABLE `t1` (
  `id` int(11) NOT NULL AUTO_INCREMENT,
  `c1` int(11) NOT NULL DEFAULT '1',
  `c2` varchar(128) DEFAULT NULL,
  `c3` float DEFAULT NULL,
  PRIMARY KEY (`id`),
  KEY `idx_1` (`c1`),
  KEY `idx_2` (`c2`)
) ENGINE=InnoDB AUTO_INCREMENT=11 DEFAULT CHARSET=latin1 /*!99000 ROW_FORMAT=GCS */ 
alter table t1 add column c4 int;
affected rows: 1
info: Records: 1  Duplicates: 0  Warnings: 0
alter table t1 row_format=compact;
affected rows: 1
info: Records: 1  Duplicates: 0  Warnings: 0
alter table t1 row_format=gcs;
affected rows: 1
info: Records: 1  Duplicates: 0  Warnings: 0
truncate table t1;
affected rows: 0
insert into t1 set id=1;
insert into t1 set id=2;
insert into t1 set c2='aaaa';
delete from t1 where c2='1';
delete from t1 where id=1;
update t1 set id=1 where c2='aaaa';
select * from t1;
id	c1	c2	c3	c4
1	1	aaaa	NULL	NULL
2	1	NULL	NULL	NULL
create temporary table t2 like tt;
show create table t2;
Table	Create Table
t2	CREATE TEMPORARY TABLE `t2` (
  `id` int(11) NOT NULL AUTO_INCREMENT,
  `c1` int(11) NOT NULL DEFAULT '1',
  `c2` varchar(128) DEFAULT NULL,
  `c3` float DEFAULT NULL,
  PRIMARY KEY (`id`),
  KEY `idx_1` (`c1`),
  KEY `idx_2` (`c2`)
) ENGINE=InnoDB DEFAULT CHARSET=latin1 /*!99000 ROW_FORMAT=GCS */ 
insert into t2 set id=10;
affected rows: 1
insert into t2 set id=10;
ERROR 23000: Duplicate entry '10' for key 'PRIMARY'
select * from t2;
id	c1	c2	c3
10	1	NULL	NULL
affected rows: 1
alter table t2 row_format=gcs;
affected rows: 1
info: Records: 1  Duplicates: 0  Warnings: 0
create temporary table t3 as select * from t1;
show create table t3;
Table	Create Table
t3	CREATE TEMPORARY TABLE `t3` (
  `id` int(11) NOT NULL DEFAULT '0',
  `c1` int(11) NOT NULL DEFAULT '1',
  `c2` varchar(128) DEFAULT NULL,
  `c3` float DEFAULT NULL,
  `c4` int(11) DEFAULT NULL
) ENGINE=MyISAM DEFAULT CHARSET=latin1
select * from t3;
id	c1	c2	c3	c4
1	1	aaaa	NULL	NULL
2	1	NULL	NULL	NULL
truncate table t3;
truncate table t1;
drop table t1;
show create table t1;
Table	Create Table
t1	CREATE TABLE `t1` (
  `id` int(11) DEFAULT NULL
) ENGINE=MyISAM DEFAULT CHARSET=latin1
select * from t1;
id
100
drop table t1;
drop table t2;
drop table t3;
DROP TEMPORARY TABLE IF EXISTS bug48067.t1;
DROP DATABASE IF EXISTS bug48067;
CREATE DATABASE bug48067;
CREATE TABLE bug48067.t1 (c1 int) engine=innodb row_format=gcs;
INSERT INTO bug48067.t1 values (1);
CREATE TEMPORARY TABLE bug48067.t1 (c1 int)engine=innodb row_format=gcs;
DROP DATABASE bug48067;
DROP TEMPORARY table bug48067.t1;
drop table tt;
